{"coverage":{"content_bytes":50,"content_files":3,"indexed_files":4,"selected_files":4,"skipped_files":1,"tracked_files":4},"facts":[{"evidence_sha256":"a8076d3d28d21e02012b20eaf7dbf75409a6277134439025f282e368e3305abf","fact_id":"file:bin/demo","kind":"repository-file","path":"bin/demo"},{"evidence_sha256":"78a31ea290dee1f2276ea06f9dbc1752bdda4313dfad95064da056b1ef64216d","fact_id":"file:package.json","kind":"repository-file","path":"package.json"},{"evidence_sha256":"03481a56daf9beb1a49e467a3e3ccd654ea68771567825a9745662410dc8a94c","fact_id":"file:tests/test_demo.py","kind":"repository-file","path":"tests/test_demo.py"}],"files":[{"bytes":10,"content":"#!/bin/sh\n","lines":1,"path":"bin/demo","sha256":"a8076d3d28d21e02012b20eaf7dbf75409a6277134439025f282e368e3305abf"},{"bytes":28,"content":"{\"bin\":{\"demo\":\"bin/demo\"}}\n","lines":1,"path":"package.json","sha256":"78a31ea290dee1f2276ea06f9dbc1752bdda4313dfad95064da056b1ef64216d"},{"bytes":12,"content":"assert True\n","lines":1,"path":"tests/test_demo.py","sha256":"03481a56daf9beb1a49e467a3e3ccd654ea68771567825a9745662410dc8a94c"}],"policy":{"allowed_consumers":["audit","readme"],"missing_evidence":[],"publish_eligible":false,"required_evidence":["install-entry","manifest","usage-or-test"],"satisfied_evidence":["install-entry","manifest","usage-or-test"]},"project_type":"cli","scan_limits":{"max_depth":12,"max_directories":500,"max_file_bytes":524288,"max_files":2000,"max_seconds":5,"max_total_bytes":50},"schema_version":2,"skipped":[{"path":"zzz.txt","reason":"total-size-limit","required_for_generation":false}],"status":"partial","target":{"base_sha":null,"name":"fixture"},"warnings":[]}
